id,name,classification,module_origin,source_path,evidence_path,reason,risk,permitted_use,blocked_use,doctor_verdict
TABLE-001,ARCHIVE_CANONICAL_SPECTRUM,TAINTED_REPLAY,37_repair3_forensic_pdg_reimport_quarantine_v3_7,36_repair2_archive_formula_source_extraction_execution / archive canonical spectrum table,37_repair3_forensic_pdg_reimport_quarantine_v3_7/results/forensic_audit_verdict_v3_7.json,All 12 rows have mass_calc equal reference and zero residual; confirmed reference table replay.,PDG/reference replay masquerading as execution if used as derivation.,Quarantine evidence only; never mass derivation input; never Debt 9 closure.,"No formula selection, no scale fitting, no current/canon promotion.",QUARANTINE_MODULE36_DENY_CANON_DENY_CURRENT
TABLE-002,ARCHIVE_NOPARAMSM_ENSEMBLE / NoParamSM solver outputs,TAINTED_REPLAY,37_repair3_forensic_pdg_reimport_quarantine_v3_7,NoParamSM/noparamSMsolver.py archived formula / module36 extraction,37_repair3_forensic_pdg_reimport_quarantine_v3_7/results/forensic_audit_verdict_v3_7.json,NoParamSM engine was previously classified as prototype_with_input_leakage; rerun confirms PDG input mutation follows outputs.,Mass engine uses observed masses internally and modulates them; not a no-parameter derivation.,Regression test and quarantine marker only.,No predictive mass-spectrum claim; no Debt 9 closure.,QUARANTINE_MODULE36_DENY_CANON_DENY_CURRENT
TABLE-003,ARCHIVE_EXTENDED_MONOLITH_BOSON_ENSEMBLE,TAINTED_REPLAY,37_repair3_forensic_pdg_reimport_quarantine_v3_7,module36 extended monolith output family,37_repair3_forensic_pdg_reimport_quarantine_v3_7/results/forensic_audit_rerun_stats_v3_7.json,Belongs to the same quarantined module36/extended monolith source family; low residuals are not accepted without PDG-free provenance.,Possible reference-coupled replay or hidden calibration.,Quarantine evidence; compare only after independent derivation is supplied.,"No direct derivation, no canon/current promotion.",QUARANTINE_MODULE36_DENY_CANON_DENY_CURRENT
TABLE-004,ARCHIVE_EXTENDED_MONOLITH_NUCLEON_ENSEMBLE,TAINTED_REPLAY,37_repair3_forensic_pdg_reimport_quarantine_v3_7,module36 extended monolith output family,37_repair3_forensic_pdg_reimport_quarantine_v3_7/results/forensic_audit_rerun_stats_v3_7.json,Belongs to the same quarantined module36/extended monolith source family; low residuals are not accepted without PDG-free provenance.,Possible reference-coupled replay or hidden calibration.,Quarantine evidence; compare only after independent derivation is supplied.,"No direct derivation, no canon/current promotion.",QUARANTINE_MODULE36_DENY_CANON_DENY_CURRENT
TABLE-005,ARCHIVE_EXTENDED_MONOLITH_BINDING_ENSEMBLE,TAINTED_REPLAY,37_repair3_forensic_pdg_reimport_quarantine_v3_7,module36 extended monolith output family,37_repair3_forensic_pdg_reimport_quarantine_v3_7/results/forensic_audit_rerun_stats_v3_7.json,Belongs to the same quarantined module36/extended monolith source family; low residuals are not accepted without PDG-free provenance.,Possible reference-coupled replay or hidden calibration.,Quarantine evidence; compare only after independent derivation is supplied.,"No direct derivation, no canon/current promotion.",QUARANTINE_MODULE36_DENY_CANON_DENY_CURRENT
TABLE-006,F_hadron geometric mean prescription,STRUCTURAL_HINT,58_debt9_hadron_scale_provenance_audit_v5_8,00_original_metatime/Metatime-main/documents/SM_and_M_Theory_generalisation.pdf,58_debt9_hadron_scale_provenance_audit_v5_8/results/hadron_scale_provenance_audit_v5_8.json,"Baryons and mesons are constructed from quark F_ij values via a geometric-mean prescription F_hadron = product(F_qi,qj)^(1/Npairs).",No independent MeV scale is shown in the same table.,Can seed future operator family after freeze; no MeV scale input.,No mass prediction or Debt 9 closure until independent route is frozen and benchmarked.,DENY_CURRENT_UNTIL_SCALE_PROVENANCE
TABLE-007,SM_and_M_Theory exact baryon table,UNKNOWN_PROVENANCE,58_debt9_hadron_scale_provenance_audit_v5_8,00_original_metatime/Metatime-main/documents/SM_and_M_Theory_generalisation.pdf,58_debt9_hadron_scale_provenance_audit_v5_8/results/hadron_scale_provenance_audit_v5_8.json,"Table lists Proton 938.3 vs 938.3, Neutron 939.6 vs 939.6, Lambda 1115.7 vs 1115.7, Sigma+ 1189.4 vs 1189.4 with 0.0% errors.",Exact equality to displayed benchmark precision requires executable provenance before promotion.,"Hold as provenance-required result table only; exact equality is not rejected, but cannot promote without executable scale route.",No mass prediction or Debt 9 closure until independent route is frozen and benchmarked.,DENY_CURRENT_UNTIL_SCALE_PROVENANCE
TABLE-008,Formal_SM baryon binding formula,STRUCTURAL_HINT,58_debt9_hadron_scale_provenance_audit_v5_8,58_debt9_hadron_scale_provenance_audit_v5_8 source audit text,58_debt9_hadron_scale_provenance_audit_v5_8/METATIME_SM_DEBT9_HADRON_SCALE_PROVENANCE_AUDIT_v5_8.md,"Classified by v5.8 text; exact/marginal results are not rejected, but need independent executable scale provenance before promotion.",Unclear scale provenance or benchmark coupling.,Formula/operator clue only; E_bind needs independent derivation.,No mass prediction or Debt 9 closure until independent route is frozen and benchmarked.,DENY_CURRENT_UNTIL_SCALE_PROVENANCE
TABLE-009,Formal_SM mixed baryon binding table,SCORING_ONLY,58_debt9_hadron_scale_provenance_audit_v5_8,00_original_metatime/Metatime-main/documents/Formal_SM.pdf,58_debt9_hadron_scale_provenance_audit_v5_8/results/hadron_scale_provenance_audit_v5_8.json,"Proton/neutron/Sigma/Xi close; Lambda deviates strongly, suggesting additional dynamics or SU(3)-breaking corrections.",Not an exact universal closure; shows real residuals and missing dynamics.,Diagnostic residual table only; mixed accuracy blocks universal closure.,No mass prediction or Debt 9 closure until independent route is frozen and benchmarked.,DENY_CURRENT_UNTIL_SCALE_PROVENANCE
TABLE-010,Calabi_Yau2 calibrated baryon table/warning,SCORING_ONLY,58_debt9_hadron_scale_provenance_audit_v5_8,00_original_metatime/Metatime-main/documents/Calabi_Yau2.pdf,58_debt9_hadron_scale_provenance_audit_v5_8/results/hadron_scale_provenance_audit_v5_8.json,Binding energy scale 5-50 MeV for light quarks; meson beta calibrated to PDG masses; compare to PDG and iterate small adjustment of F_ij if needed.,Explicit calibration/iteration language blocks no-parameter promotion.,"Calibration/iteration evidence; useful warning against underbound scale, not derivation.",No mass prediction or Debt 9 closure until independent route is frozen and benchmarked.,DENY_CURRENT_UNTIL_SCALE_PROVENANCE
TABLE-011,Perfect numbers prime-product sigma/R(n) baryon route,STRUCTURAL_HINT,58_debt9_hadron_scale_provenance_audit_v5_8,00_original_metatime/Metatime-main/documents/Perfect_numbers_and_rhe_strings.pdf,58_debt9_hadron_scale_provenance_audit_v5_8/results/hadron_scale_provenance_audit_v5_8.json,"Hadron mapped to product of quark primes; for proton u↔3,d↔5, n_p=45, sigma(45)=78, R(45)=1.73; mismatch acknowledged and harmonic corrections required.",No final MeV-scale map from R(n)/L(n) to hadron masses is completed there.,Clean route candidate for v5.9-like operator; not a benchmark table input.,No mass prediction or Debt 9 closure until independent route is frozen and benchmarked.,DENY_CURRENT_UNTIL_SCALE_PROVENANCE
TABLE-012,v4.4 sealed M_MT benchmark,SCORING_ONLY,44_debt9_mmt_sealed_benchmark_v4_4,44_debt9_mmt_sealed_benchmark_v4_4/results/sealed_mmt_benchmark_v4_4.json,44_debt9_mmt_sealed_benchmark_v4_4/results/sealed_mmt_benchmark_v4_4.json,Post-freeze benchmark only; frozen operator not mutated; result falsifies direct mass-spectrum interpretation.,Reusing benchmark rows as formula inputs would create hidden fit/replay risk.,Scoring-only after freeze; regression tests; historical evidence.,No operator construction or scale normalization from this table unless explicitly reclassified in a future provenance audit.,SCORING_ONLY_DENY_INPUT_REUSE
TABLE-013,v4.6 document formula selection benchmark,SCORING_ONLY,46_debt9_document_formula_selection_benchmark_v4_6,46_debt9_document_formula_selection_benchmark_v4_6/results/document_formula_selection_benchmark_v4_6.json,46_debt9_document_formula_selection_benchmark_v4_6/results/document_formula_selection_benchmark_v4_6.json,"Document formula route benchmarked after formula selection; family anchor makes it diagnostic, not no-parameter prediction.",Reusing benchmark rows as formula inputs would create hidden fit/replay risk.,Scoring-only after freeze; regression tests; historical evidence.,No operator construction or scale normalization from this table unless explicitly reclassified in a future provenance audit.,SCORING_ONLY_DENY_INPUT_REUSE
TABLE-014,v5.2 sealed charged-lepton kernel benchmark,SCORING_ONLY,52_debt9_sealed_charged_lepton_kernel_benchmark_v5_2,52_debt9_sealed_charged_lepton_kernel_benchmark_v5_2/results/sealed_charged_lepton_kernel_benchmark_v5_2.json,52_debt9_sealed_charged_lepton_kernel_benchmark_v5_2/results/sealed_charged_lepton_kernel_benchmark_v5_2.json,Sealed charged-lepton benchmark is post-freeze scoring; cannot be reused as input anchor.,Reusing benchmark rows as formula inputs would create hidden fit/replay risk.,Scoring-only after freeze; regression tests; historical evidence.,No operator construction or scale normalization from this table unless explicitly reclassified in a future provenance audit.,SCORING_ONLY_DENY_INPUT_REUSE
TABLE-015,v5.3 Ramanujan/OI lepton normalizer benchmark table,SCORING_ONLY,53_debt9_ramanujan_oi_lepton_normalizer_v5_3,53_debt9_ramanujan_oi_lepton_normalizer_v5_3/results/ramanujan_oi_lepton_normalizer_v5_3.json,53_debt9_ramanujan_oi_lepton_normalizer_v5_3/results/ramanujan_oi_lepton_normalizer_v5_3.json,"Refinement/normalizer result table; use as diagnostic history, not as input to next formula.",Reusing benchmark rows as formula inputs would create hidden fit/replay risk.,Scoring-only after freeze; regression tests; historical evidence.,No operator construction or scale normalization from this table unless explicitly reclassified in a future provenance audit.,SCORING_ONLY_DENY_INPUT_REUSE
TABLE-016,v5.4 Ramanujan component-split lepton refinement table,SCORING_ONLY,54_debt9_ramanujan_component_split_lepton_refinement_v5_4,54_debt9_ramanujan_component_split_lepton_refinement_v5_4/results/ramanujan_component_split_lepton_refinement_v5_4.json,54_debt9_ramanujan_component_split_lepton_refinement_v5_4/results/ramanujan_component_split_lepton_refinement_v5_4.json,Strong lepton diagnostic table; must not seed post-hoc fit without predeclared rule.,Reusing benchmark rows as formula inputs would create hidden fit/replay risk.,Scoring-only after freeze; regression tests; historical evidence.,No operator construction or scale normalization from this table unless explicitly reclassified in a future provenance audit.,SCORING_ONLY_DENY_INPUT_REUSE
TABLE-017,v6.0A hadron ratio benchmark table,SCORING_ONLY,60_hadron_ratio_benchmark_v6_0A,60_hadron_ratio_benchmark_v6_0A/results/hadron_ratio_benchmark_v6_0A.json,60_hadron_ratio_benchmark_v6_0A/results/hadron_ratio_benchmark_v6_0A.json,Benchmark performed after v5.9 formula freeze; absolute MeV scale is explicitly not derived.,Reusing benchmark rows as formula inputs would create hidden fit/replay risk.,Scoring-only after freeze; regression tests; historical evidence.,No operator construction or scale normalization from this table unless explicitly reclassified in a future provenance audit.,SCORING_ONLY_DENY_INPUT_REUSE
TABLE-018,v6.1 Planck information-action target ledger,SCORING_ONLY,61_planck_information_action_ledger_v6_1,61_planck_information_action_ledger_v6_1/results/planck_information_action_ledger_v6_1.json,61_planck_information_action_ledger_v6_1/results/planck_information_action_ledger_v6_1.json,Target ledger derived from known masses for action targets; cannot count as deriving S_I.,Reusing benchmark rows as formula inputs would create hidden fit/replay risk.,Scoring-only after freeze; regression tests; historical evidence.,No operator construction or scale normalization from this table unless explicitly reclassified in a future provenance audit.,SCORING_ONLY_DENY_INPUT_REUSE
TABLE-019,v6.2 lepton information-action release scoring,SCORING_ONLY,62_lepton_information_action_release_probe_v6_2,62_lepton_information_action_release_probe_v6_2/results/lepton_information_action_release_probe_v6_2.json,62_lepton_information_action_release_probe_v6_2/results/lepton_information_action_release_probe_v6_2.json,Release probe score uses v6.1 targets only after predeclared rules; not absolute mass derivation.,Reusing benchmark rows as formula inputs would create hidden fit/replay risk.,Scoring-only after freeze; regression tests; historical evidence.,No operator construction or scale normalization from this table unless explicitly reclassified in a future provenance audit.,SCORING_ONLY_DENY_INPUT_REUSE
TABLE-020,v3.8 PDG-free structural signature,SOURCE_DERIVED,38_pdg_free_sm_gauge_chiral_scalarization_v3_8,38_pdg_free_sm_gauge_chiral_scalarization_v3_8/results/pdg_free_structural_signature_v3_8.json,38_pdg_free_sm_gauge_chiral_scalarization_v3_8/results/pdg_free_structural_signature_v3_8.json,"PDG-free structural signature derived from gauge/chiral/scalar structure; permitted as structural input, not a mass table.",May become tainted if later normalized by benchmark mass without declaring anchor.,Structural operator/source ingredient only under freeze-before-benchmark rule.,No hidden mass-scale calibration; no direct Debt 9 closure.,ALLOW_STRUCTURAL_USE_DENY_MASS_CLOSURE
TABLE-021,v5.9 prime-product hadron carrier candidate,SOURCE_DERIVED,59_debt9_prime_product_hadron_scale_candidate_v5_9,59_debt9_prime_product_hadron_scale_candidate_v5_9/results/prime_product_hadron_scale_candidate_v5_9.json,59_debt9_prime_product_hadron_scale_candidate_v5_9/results/prime_product_hadron_scale_candidate_v5_9.json,Pre-benchmark carrier/fingerprint source for v6.0A ratio benchmark; no MeV table input.,May become tainted if later normalized by benchmark mass without declaring anchor.,Structural operator/source ingredient only under freeze-before-benchmark rule.,No hidden mass-scale calibration; no direct Debt 9 closure.,ALLOW_STRUCTURAL_USE_DENY_MASS_CLOSURE
TABLE-022,v6.0B information-energy normalizer formula ledger,STRUCTURAL_HINT,60B_information_energy_normalizer_v6_0B,60B_information_energy_normalizer_v6_0B/results/information_energy_normalizer_v6_0B.json,60B_information_energy_normalizer_v6_0B/results/information_energy_normalizer_v6_0B.json,Dimensional bridge ledger; defines need for E0 and blocks pure dimensionless info-to-joule claim.,May become tainted if later normalized by benchmark mass without declaring anchor.,Structural operator/source ingredient only under freeze-before-benchmark rule.,No hidden mass-scale calibration; no direct Debt 9 closure.,ALLOW_STRUCTURAL_USE_DENY_MASS_CLOSURE
